title,rating,travelDate,publishedDate,text
Simply  Awesome....in one word Mind-blowing,5,2024-02,27-02-2024,From the best Check in experience  courtesy Yamini and Megha to the entire stay....an overall amazing  experience Thank  you Team Taj Krishna...you guys are the best!!!  The team at the Taj lounge also went out ofctheir way to make our experience  great!
Appreciation for Mr. Angad and Mr. Karim,5,2024-02,27-02-2024,"Went for official purpose was amazed to see the hospitality shown by Mr. Angad and Mr. Karim
Delighted by the experience.
They left no stone unturned to make my experience wonderful
The kind of welcome done by the staff was unbelievable 
Kudos to the staff."
Extremely comfortable stay,5,2024-02,27-02-2024,Our stay was extremely comfortable and enjoyable. The entire team was extremely warm and went out of their way to make the stay so enjoyable. We were given an early check in as well as an upgrade. What we found really commendable was the fact that the team was so warm and went above and beyond to ensure that every request was taken care of and the stay was so perfect in every way. Kudos to the team!! Keep it up Taj Krishna. Look forward to visiting again!!
Wonderful day,5,2024-02,27-02-2024,It was a wonderful day in taj Krishna and excellent service by Yamini from reception. I had stayed hear for little time only but impressed plot by their gestures and hospitality tq so much for the wonderful service  and tq so much Yamini for ur service
Wonderful stay,5,2024-02,27-02-2024,It was a wonderful stay. The food and the ambiance was very nice. Special thanks to Mr Ajay who took care of our stay and made all the efforts to make our stay comfortable. The housekeeping department was extremely sweet and were extremely good with their work.
Good,5,2024-02,26-02-2024,"Food was soo good in encounter stay was comfortable really like the checking and check out process will come back soon would like to mention Megha, Ritu, Mohith, Mamta,Vincent, Pravin,  Pranith,  janvi,Raju,Raghu they are really good overall good stay and comfortable"
Outstanding,5,2024-02,26-02-2024,"Really appreciate the coordination of the team especially Front desk Really appreciate Vincent,Megha,Pranith,Ritu,Mohith,Mamta,Pravin they are rock 

The food and grand ball room was so good Really no need for worries 
Best regards to taj krishna"
Amazing wonderful hotel the services employees everyone is very nice,5,2024-01,26-02-2024,Thank you very much Ajay for making our stay comfortable it's all thanks to you for making sure that we are happy comfortable in taj Krishna the way you took care of us that was very nice .Even if your busy you meet your guest you make them comfortable your gesture your way to talk with people is just very nice I am impressed and from now onwards I think whenever I will come in Hyderabad I am going to stay in taj Krishna. Thank you Ajay amazing person you are .
Ajay thank you very much your the star of this hotel .,5,2024-02,26-02-2024,"Taj Krishna hotel is very nice and I must say this there was Ajay who is just not only the employee in Taj Krishna but this boy  really loves his hotel and guest, I want to say this the respect which we got from Ajay is just unforgettable and I will always remember this hotel and Ajay for making our stay comfortable ."
Superb service amazing people amazing hotel.,5,2024-02,26-02-2024,"Amazing service amazing people in taj krishna this is my personal experience, I really want to thank Ajay who works in taj krishna he is amazing person very kind polite the way he talks respectfully with everyone and because of him I think my stay was super amazing I didn't expect that but i had a super comfortable stay in taj krishna , thank you so much ajay for making sure that my stay is comfortable in taj."
Amazing service amazing employee like Ajay . East west raj krishna is the besttttt.,5,2024-02,26-02-2024,Taj Krishna is the bestest one to stay it's all because of the employees hard work such as Ajay . I must say this person is amazing every time I stay in Hyderabad taj Krishna I feel relieved and I feel comfortable as I know in this hotel such people work who are always there for there guest like Ajay. Thank you very much Ajay and taj Krishna for making our stay memorable comfortable.
Amazing Stay! Good Hospitality.,5,2024-02,26-02-2024,"We've been regular guests at Hotel Krishna and each visit reaffirms why we keep coming back. The hospitality and care provided by Renu, Ajay, Dominic, Taniya, Yamini and the entire team make our stay thoroughly enjoyable. Their dedication to ensuring our comfort is evident in every interaction. The warm ambiance and exceptional service create a welcoming atmosphere that makes us feel valued as guests. We truly appreciate the efforts of everyone at Hotel Krishna and look forward to many more memorable stays."
Good experience,5,2024-02,25-02-2024,"To be very honest I don’t know how to tell the stay was so comfortable Megha help in check-in Mamta in escorting , Ritu , Vincent , Mohith and Pravin just this team was so good even the food was good 
Really appreciate the hospitality 
Thank you for helping"
Comfortable and friendly stay,5,2024-02,25-02-2024,"This is my second stay at Taj Krishna, Banjara Hills. Love the place, atmosphere and  there  friendly staff. 
Breakfast has choices of Indian vegetarian, non veg, western or order to make your favorite dishes. Every item is delicious.
Breakfast room staff is extra ordinary. Courteous, helpful, respectful and attentive to your needs. 
I would like to mention Fahad , a supervisor that works shoulder to shoulder with his staff. 
Gopi Ram Jr Sous Chef, makes excellent Mughal dishes and serves with a big and happy smile.
Dominic , senior staff supervisor is always busy taking care of the guests.

Rest of the staff is also very attentive and helpful.

I am here for 3 weeks. My last visit in January 2023 was for 4 weeks and  I felt at home away from home at TAJ KRISHNA , Banjara Hills. 
You can also experience your stay here if you are planning to visit Hyderabad a beautiful and vibrant city , a mixture of old culture, new and modern  styles. The best city to visit and explore
And ofcourse my recommendation for stay is Taj Krishna Banjara Hills"
Hyderabad,5,2024-02,25-02-2024,"I had a wonderful stay at the hotel. The staff were incredibly polite and professional, making me feel genuinely welcome and attended to. The overall experience was very comfortable, and the delicious food added an extra layer of enjoyment to my stay. I look forward to visiting again in the future."
Marvellous,5,2024-02,25-02-2024,My Ajay &Mr jitesh  from floors department are  so sweet kind and helpfull me and my roomate we were sleeping and skipped the buffet timings but still because of Mr Ajay and Mr jitesh they arranged some sandwiches for us it was so kindly of them &i really enjoyed a sweet conversation with Mr Ajay very concerned person and kudos to the whole housekeeping mr saroj is so helpful he helped us  with all the toiletries such a great personality I was a really great stay with taj Krishna.
Good,5,2024-02,24-02-2024,"The stay ia bit awesome and as a family we enjoyed it. The hoapitality is as usual awesome. Thanks to Tan Krishna team. Appreciate your work. Food and everything was soo good thanks to front office team specially Megha, Mohith, Mamta, Ritu, Vincent, Piyush, Vincent"
"Beautiful hotel, awesome gardens, convenient location and great stay.",5,2024-02,24-02-2024,"It’s always a pleasure and a wonderful experience staying at Taj.  The rooms are beautiful. Efficient and professional staff. Clean and hygienic service and great food and awesome breakfast that I’d not miss. Check in and check out is fast and easy. 
Stunningly maintained gardens and beautiful views from my room."
Excellent,5,2024-02,23-02-2024,"Excellent experience. Food was delicious and service was brilliant. Pool is sometimes closed a little early which means you miss using it in the evening. Gym is open 24 hours. Staff are very attentive, in particular Yanina was extra helpful"
F&b service,5,2024-02,22-02-2024,"Thank you so much for making our stay very comfortable.. I would like to specially thanks to Karim to take care of us very well, he always make sure we got our food on time as well as he is very approachable.. thanks to everyone for amazing hospitality and made our stay very enjoyable....happy to visit again"
Great stay at Taj,5,2024-02,22-02-2024,"I had an absolutely fantastic stay at Krishna! The hospitality was unparalleled, starting with the warm welcome and the beautiful traditional aarti ceremony. A big thank you to Ms. Ritu, Tania, and Yamni for making me feel so special upon my arrival.The housekeeping was impeccable, with the rooms always kept clean and tidy. Huge appreciation to Ajay and his team for their outstanding efforts.And let's talk about the food, it was simply amazing! Mr. Domic and Kareem, thank you for the culinary delights that made my stay even more memorable.Overall, my experience at Krishna was exceptional, thanks to the wonderful team who made me feel at home. I can't wait to visit again!"
Late night dinner in taj Krishna,5,2024-01,22-02-2024,"I had dinner in taj krishna, the food was good, and very good alcoholic beverages as well, the manager was ao friendly and yamini assisted well thanks for the effort, everything was soo smooth. Thank you taj I would love to visit again with my family and friends."
Thank you Taj Krishna for the amazing day,5,2023-12,22-02-2024,"I went to Taj Krishna on the occasion of my birthday, I spend a day there everything was good. And desserts were amazing, special mention yamini thank you for the suggestion, I thought it would be a regular brunch, but it was far better than what I expected."
Best Hotel in Hyderabad Banjara hills and super comfy stay,5,2024-02,21-02-2024,"Super helpful staff and excellent service. Being a Epicure Preferred and Taj Silver member I found it one of great hotels run by professional service. Thanks for wonderful time!

Highly recommended for super location and excellent property."
Excellent Hospitality and amazing guest service,5,2024-02,21-02-2024,"Experience excellence at Taj Krishna, Hyderabad! We thoroughly enjoyed our time at Krishna. Ritu's gracious welcome, coupled with the impeccable service from Yamini, Tania, and Ajay, made our stay truly remarkable. Special thanks to Aviyas from in-room dining,  Sharath and Chef Calvin from the restaurant for their attentive care throughout our visit. The delectable cuisine and cozy rooms made our stay truly unforgettable. Kudos to the wonderful management and staff for making our stay a memorable one."
Business brunch in taj Krishna,5,2023-11,21-02-2024,"I came to taj with my manager and had lunch there, the food was nice and i loved the ambiance as well.
We covered all the aesthetics of taj Krishna with the help of yamini, thanks for the time yamini, she might be the hotel receptionist, but she knew each corner of taj Krishna."
Wonderful 👍 job . Keep continuing the good work with the support extended to each one,5,2024-02,20-02-2024,Wonderful experience.. Kudos to team Taj Krishna Hyderabad. Keep inspiring the greatness of Taj . Looking forward for the continual support . Supporting staff Yamini done a good welcome gesture on arrival. Team Taj Good job done . Keep continuing the good work ahead.
Experience of Excellence,5,2024-02,20-02-2024,"I started writing this feedback with ""My stay at Taj Krishna..."" but deleted it as I don't think it was a mere stay and feedback of how comfortable the rooms were, and how good the food was. It cannot be about what I liked and didn't like too. It is the Taj, They are for sure top-notch.
Once you enter the premises of Taj Krishna, Hyderabad, take that U-turn from the signal before its main entrance while coming from a long-delayed flight and a cab ride of about 50 minutes from the airport it is a whole different world. You don't experience the hospitality after you check in to your room or when you reach the reception. It starts from the very main entrance. The environment just after the main entrance is an invitation to the excellence of everything we will experience. The entrance to the main lobby, how the luggage was handled, everything had a touch of care. Check-in was smooth and was made easy with the booking, but the way we were welcomed was as if they were waiting for us only. Small little details are what make the big difference in any business sector and that was there. My father and mother were traveling with me and they appreciated every one of them. I would like to thank Megha, Mohith, and Vincent for taking care of those small details. I have been welcomed at multiple hotel lobbies with some garlands, bouquets, welcome drinks, and even the kumkum tilak on my forehead. I was welcomed here with a tilak on my forehead but what was accompanying it was nice. Megha put that tilak and said ""It is for your good health"" 
We had our dinner at Firdaus, well almost all the main meals, lunch and dinner, there only and the team of Mr. Kenneth Reddy, Farhat, Jennifer, Manas, G. L. Reddy and the chefs who were behind the food that were served made us feel to come back again during any stay at Taj. 
Rather than feedback, I would like to call it a thank-you note to all of you!"
A day in taj krishna,4,2024-02,20-02-2024,"The atmosphere at taj Krishna was amazing and the food is delight. Thank you Yamini for the amazing hospitality, she took the time and effort to show the aesthetics of taj krishna. The amenities provided are great. Had a great experience and would love to visit again"
Top Class,5,2024-02,20-02-2024,"We stayed for 3 nights to see local historical sites. Very comfortable large room with fabulous views. All the staff were very friendly and welcoming. We arrived at 7.30 am after a long flight and no sleep. They found us a room by 9.30am which was great. 

Lovely swimming pool and gardens. Staff and manager in the main restaurant were very friendly and helpful at all times."
Wonderful experience from taj,5,2024-02,19-02-2024,It’s a wonderful day in taj krishna we are here with the family for 3 days it’s a marvellous experience with the team special thanks to Yamini &Manoj from reception for their wonderful hospitality service and we experienced lots of memories and specials from hotel side
Excellent vacation,5,2024-02,19-02-2024,"I had an exceptional stay at Krishna in Hyderabad recently and wanted to share my wonderful experience. From the moment I arrived, Ms. Ritu, Tania and Pranit at the reception made me feel incredibly welcome with there warm greeting and efficient check-in process.Throughout my stay, Sachin, Calvin, and Raja consistently provided top-notch room cleaning service, ensuring that my accommodations were always comfortable and spotless.I also want to commend Ajay and Swati, the floor managers, for their exceptional care and attention to detail. They went out of their way to ensure that all my needs were met during my stay, further enhancing my experience at the hotel.The staff's dedication to providing excellent service truly made my stay memorable, and I would highly recommend this hotel to anyone visiting Hyderabad."
Karim and Lenmi,5,2024-02,19-02-2024,"As always I had a very pleasant experience staying at Taj. The staff here is very sweet and helpful. Came across Mr.karim and Ms. lenmi at the dining hall, Service industry needs more genuine and hardworking people like them. Very proactive and on their toes."
It was a wonderful experience at Taj Krishna,5,2024-02,19-02-2024,"The stay was very pleasant . It was our marriage anniversary and taj as expected gave us a wonderful experience.
Our room was upgraded on request without any difficulty. All the staffs were very helpful and courteous to name a few Megha , Mohith , Mamta and Vincent . Special mention to Megha she was there with us while to celebrate while we cut our anniversary cake. Everyone at taj saw to that our requests were fulfilled and went beyond that, “Waah Taj”."
Megha thanks,5,2024-02,17-02-2024,Awesome service Megha change my room accordingly what I want I really appreciate her efforts she is very corporative I would mention Vincent Mohith and mamta also they are also helpful but special thanks to Megha next time come for long time
"Taj Krishaa, Hyderabad",5,2024-02,17-02-2024,"Overall, stay was very relaxing and rejuvenating. Food quality and hygiene was at per with Taj standards. The staff were very humble and warm. Especially, Tania, Guest relations executive was very helpful and kind in making us feel comfortable throughout the stay. A small surprise she has arranged for us was very special, and made her our stay more memorable. Thank you for everything!"
I would like to thank mr Ajay for being a sweet and confident human being best wishes to you and keeping shining,5,2024-02,17-02-2024,"It was a great experience all the staffs are lovely well behaved and very helpful 
Rooms are also beautiful with very comfortable bed and pillow as well 
Food is also great 
Even the property is beautiful I liked the swimming pool area a lot very peaceful and chill."
Outstanding,5,2024-02,16-02-2024,"Come with group all the government leader trust me Megha help each and guest alot by escort to checking allocating room was so smooth even i could like to mention Vincent, Mohith , Pravin , Pranith and Mamta also 
Special thanks to Megha , Vincent and Mohith best hotel
From SCCL company"
Day out at Taj Krishna Hyderabad,5,2024-02,15-02-2024,"Absolutely Superb, Right from the Checkin at the Front Office to the Restaurant .

The warm Welcome with Tikka, Aarti and the Tulsi Garland along with the Smile and Wishes removes all the tiredness of the Journey.

The Beakfast and the the Dinner Spread was equally Good.

Hope to visit some of more locations in Future."
Exceptional hospitality.,5,2024-02,15-02-2024,"Thank you to the entire team at Taj Krishna, Hyderabad for hosting us. We had a fantastic stay and truly appreciated the hospitality and warmth extended to us. Special thanks to all the amazing staff members who made our experience memorable. The food was exceptional, and the rooms were clean and tidy. A shoutout to the outstanding housekeeping and reception staff. Pranit, Ajay, Krishna, Tania, Renu, and Saurab were absolutely fantastic! Additionally, we loved the Forest Essentials pillow mist, which helped us have a peaceful sleep. The gesture of gifting it was truly wonderful and added to our delightful experience."
Amazing,5,2024-02,15-02-2024,I always enjoy my stay at Taj Krishna. Really appreciate manager named Ajay and staff named Karim. They were so professional and customer centric. Thank you so much for your effort and kindness. Always feel welcomed because of staff like them !!
Amazing service,5,2024-02,14-02-2024,The service  is exceptional! Very tasty and well prepared and you can choose among many menu options. I love the service at the place and the waiter is so friendly with the guests and always takes care to offer the best quality! I highly recommend this place.
Delighted,5,2024-02,14-02-2024,"Greetings to the Taj Krishna family.

My visit to Taj Krishna on 11-Feb-2024 was a delight..
Having spent my anniversary at Taj Krishna was such an amazing experience.
The Hotel so very well maintained by the Taj team in every aspect shows why it's a member of the leading hotel of the world.
The associates pamper you from the porch itself with the most amazing smile that brightens the day,makes one feel that this stay with them is going to be a delight.
The traditional way of welcoming has been going on since my first visit in 2010 and 14 years later also still continues.
The tilak and the Tulsi mala welcoming is by far the best.
The delight factor was the lead bazar chuda given by the team to my wife just brought the biggest smile on smile on her.
My wife and I were treated with utmost care by the front desk team Mr.Vincent, Ms.Megha, Ms.Mamta,and Mr.Mohith.
Escorting us to our room and reassuring to extend all their services.
Decorating our room with flowers petals,a delicious chocolate cake (my all time favourite) and the swans made with towels.
All these there were the most amazing gestures that made me feel so delighted.
The team at encounters and seasons bar made sure we were seated and suggested with the best of their delicacies.
Celebrating my dinner with the team was a delight.
The turn down service (from placing tiny bits of the most amazing inhouse crafted chocolates and cleaning my room again and making sure I have the best and most comfortable sleep.
In every way Taj Krishna Hyderabad has delivered the most beautiful experience.
Kudos to the team who made my stay so memorable.

Regards,

Varun Singh 
Owner and Managing partner
Secret chefs Hyderabad."
Extraordinary stay.,5,2024-02,13-02-2024,"My experience at the Taj Krishna hotel was nothing short of extraordinary. Thanks to the entire staff at Taj Krishna for taking good care of us and for  setting the highest standard for excellence in hospitality. Many Thanks to Mr Krishna and Mr Ajay for ensuring we had our best time at Krishna, Ms Tania and Sourav for all the car during our stay and Mr Jitesh for the delicious Chocolates.  We left feeling relaxed, rejuvenated, and already looking forward to my next visit.
Extraordinary stay."
Really enjoyed ❣️,5,2024-02,12-02-2024,"Loved the service ,every one was so nice and polite ,environment was very calm and pleasent, staff was polit and professional❤️ ,mr.karem at the buffet was very nice nad took good care of us made our experience more memorable ,love to visit the again"
Amazing staff of Taj coromandel,5,2024-02,12-02-2024,"An amazing set of team lead by an amazing and hardworking Karim sir a huge respect to him for making our stay so comfortable. It's always a delight to be here , there experienced staff is such they are so effecient and empathetic towards there customers. 
Thank you"
Amazing services,5,2024-02,12-02-2024,"Amazing services given by Karim and imitiyaz. 
They made our experience very comfortable.They took care of every little detail.
Nice food and ambience.Also gym services and steam services were fantastic.
We were greeted very nicely and with smiles."
Favourite Place!,5,2024-02,12-02-2024,I can call it a next home for me not just because of the food or the comfortable room but more importantly because of the hospitality and the people out here they gives us a warm welcoming whenever we come or no matter what time it is . Mr Ajay and Mr Krishna were amazing and take good care of us during our stay and thanks to Jitesh for the lovely in house chocolates. Thanks to Ms Taniya and Sourav from the reception for the warm welcome.  Thanks to the wonderful laundry team for fixing the broken buttons of my shirt without  even telling them to. Thanks team krishna.we had our good time.
Great service.,5,2024-02,11-02-2024,Thank you so much Mr Karim and Mr Aviash for your wonderful service..you guys did a great job.. the food was amazing overall we had a great day here looking forward to come here soon.  Thank you so much to all the staff who helped us through out our stay.
Amazing Hospitality!!,5,2024-02,11-02-2024,"My stay in the hotel was awesome. The service was excellent. I would specially like to appreciate Ajay for his impeccable customer service. He was very professional and kind. Thank you Aviyash and Mukram for the chocolates. It was delicious. Also Ms Yamini and Taniya for the warm welcome. The restaurant and food was amazing Mr Sharath from the Restaurant was very courteous. And Mr Sourav for customising a city tour for us. Taj Krishna Hyderabad is highly recommended. Thanks to the entire team. 

Thanks and regards
Kanila 
Room no - 229"
Home away from Home !,5,2024-02,11-02-2024,"Taj Krishna Hyderabad is one of our favorite location in Hyderabad, more than a hotel it's a second home for us here at Hyderabad. The traditional aarati and welcome was beautiful. Ms Yamani, Tania and Sourav welcomed us home. The rooms were well maintained and cleaned. The housekeeping team here isn the best and took good care of us . Mr Ajay and his team were amazing. Special thanks to Mr Jitesh and his in room finding team for the wonderful in house made chocolates. They were amazing. Thanks agin for the wonderful hospitality team Taj Krishna. 

Regards 
Disha"
Outstanding hospitality,5,2024-02,11-02-2024,"Had a vey comfortable stay at krishna. Stayed many times here and love the hospitality here  the staff are very polite and friendly, Sepcial shoutout to Sorav and taniya at the reception and Mr ajay and his housekeeping team of saroj and zarina .would love to come back and again. Thanks again team krishna for hospiting  us . 

Warm regards 
Prateek"
Appreciation for staffs,5,2024-02,10-02-2024,"Excellent service with amazing food ..i have been here so many times but never get bored because of staffs and the hospitality they provide..Special thanks to Mr. Karim , Prakash  (Manager ), Domnic (Floor incharge )..Good to see these staffs again with the same spirit ! Please acknowledge and appreciate them from our side.."
A day well spent in taj krishna,5,2024-01,10-02-2024,"I came to Hyderabad to visit few places, and came to taj krishna for staying. The accommodation process was so smooth, thanks yamini for a sweet gestures and the check out was also completely taken care by yamini. The pool and the ambiance was nice."
Very upsetting,1,2024-02,10-02-2024,"Rooms are very old and not clean, Rooms need renovation very badly. Ac is defective throughout my stay and couldn’t fix the same even after raising multiple complaints.Front Desk staff are very kind and supportive. Breakfast is okay can be better if we have more variety spread ."
