title,rating,travelDate,publishedDate,text
Thank you ❤️,5,2024-02,10-02-2024,Thank you for the great hospitality from taj staff its a wonderful trip here iam here for just for less tenure but experienced with more memorable time i would like to thank yamini she helped me alot her presence of mind is precious thankyou taj Krishna
Nice experience,5,2024-02,09-02-2024,Taj Krishna in Hyderabad is the best hotel in Hyderabad  visit lots of five star hotel but this hotel has some to special may be the staff and for the environment check in by Mohith was smoothly and quick as I was in hurry he provide me a good quite garden view room the view of Hussain sagar lake from room just wow really love the hotel hope will come soon for more days
Very comfortable,5,2024-02,09-02-2024,I had a very comfortable stay with the prompt and par excellence service of your staff such as Kalyani and Tania. Kalyani has to be ones go to person at the bar/restaurant.  Even the late night restaurant made an effort to serve soup after closing hours. The view at the lawn side and the steam services are exceptional.
Lunch at taj krishna,5,2024-01,09-02-2024,"I came to taj with my family for lunch, it was a great experience and recommend place for lunch and dinner. The live band was great too. The environment peaceful and view is amazing. And thank you Yamini for your time and assistance. The almond chocolates at the end has nice touch."
Appraisal to staff and hospitality,5,2024-02,09-02-2024,"It was very nice experience in Taj Krishna hotel although whole hospitality was very nice but special thanks to Mr. Karim and Ms. Shruti for making it memorable.
Thank you guys for this nice experience keep going. Apart from that these the smile they were carrying while services was really positive. Very approachable!!"
Marvelous 😍 stay,5,2024-01,08-02-2024,"It's a marvelous day in taj krishna,, especially thank you so much for yamini from reception she made our stay happy and memorable thankyou for everything it's a wonderful hospitality from her side every department had taken care of us very well"
This is for KRAIM he is very kind Man and helpful  i saw him every where  he is hard working as well,5,2024-02,07-02-2024,I would like to thanks all the staff members for their hard work and i’m so happy to be here food is really tasty   And fresh services are fast   . Jatin and  Manish  are good &manager Prakash sir us humble i really enjoy my day because of these people i hope i will get a chance to here soon
Fabulous,5,2024-02,07-02-2024,"I really thanks to Megha for making this stay memorable and outstanding . I just called her for booking she made my booking give me a good view room with suprise decoration and cake last stay was not good when I come in November she promised me she will take care my next stay and she did it have this kind of staff is really a acceset . She was not there when will checked in but all time by sms she was taken care for me and I would appreciate Mamata and Mohith check in check out and escorting me 

Thank you for making my stay memorable from Mr.Varun"
Paras mehta,5,2024-02,07-02-2024,"Shahzadi Karim amul tomar for there very good hospitality taj krishna encounter restaurants nice experience gopi chef is very nice serving a food                                        thank u so much all ............
Shahzadi I think she is host very nice she is very good smily face ..

Karim serving a food very professional"
Very nice experience,5,2024-02,06-02-2024,The food service was so nice staff was so welcoming Mr. Karim and Mr Jatin was so welcoming and the experience was so nice and the things were so fresh they waited for us to dine in night which is a great gesture to us tha k you for keeping a very good care of us
Superb,5,2024-02,06-02-2024,"It was a great experience here as it's my first stay in Hyderabad and I really like the ambience. 
We landed late at night and Mr Karim and Mr jatin were here to serve us and they took each initiative to help us . These guys are very professional and I wish them luck ."
Excellent well run hotel,5,2024-02,06-02-2024,"We stayed in the Taj Krishna for three nights for tourism. The hotel seems have a mix of tourists and business travelers (more of the latter). I found the staff uniformly helpful and efficient. Our room was well appointed with a comfortable bed, a decent view of the beautiful grounds, and good quality fixtures. Nice bathroom with excellent water pressure and plenty of hot water.

We had three breakfasts here and found the staff very courteous. A specific waiter took care of us each day and by the second day he knew exactly how we liked our coffee etc - small touches that leave a pleasant impression. I mostly had the Indian items and my wife had mostly the western items - everything was great with plenty of choice. We had dinner one night in the Chinese restaurant- superlative food and service.
Next time I am in Hyderabad I would stay here again."
Feedback,5,2024-02,06-02-2024,"The rooms were very cozy the staff were superb their gesture was so professional loved their hospitality 
Moreover the staff Mr. Karism and Shruti were very polite and humble to me they took a very good care of me overall it was really nice experience"
#Taj krishna,5,2024-02,05-02-2024,Fabulous service by Mr karim . I really appreciate the hard work and the humble gesture by him. Thank you so much.. And also thank you for the hole management team for the the excellent customer service. Keep up the good work. Kudos to all staff of taj krishna!!!!!
Excellent staff service,5,2024-01,05-02-2024,I frequent visit Taj krishna for my business trip and really love the service and the staff here is very sweet and hospitable. I also want to thank and appreciate Mr Aviyash for his service and his excellent hospitality during my recent visit. He was really sweet and very kind. Keep up the good job. All the best.
Aviyash from IRD is a superstar,5,2024-01,05-02-2024,"THANK YOU Aviyash from inroom dining!!! You are a gem! You made me and my roommate feel so well taken care of after we arrived at 2am and asked for food. Checking on our well being, ensuring he set up the food trolley comfortably so that we didn’t have to move from our beds to eat knowing how exhausted we were. He was sympathetic to our work hours and requirements and the way he spoke to us and took care of us reminded us of going back home to family after being away for a long time. 
Thank you once again! :)"
Lovely stay as always,5,2024-02,05-02-2024,Mr Karim and Mr Jatin were exceptional in their services.They made our stay and dinning experience wonderful.They were quick with the services and very humble and polite with all the guests around the dinner...........Hope to visit soon..
an oasis of quiet from the traffic and honking but hotel could give more attention to several avoidable irritants,4,2024-01,04-02-2024,"The hotel and its grounds offer an oasis of quiet from the traffic and attendant honking.  The hotel's public areas, its grounds and the garden are lovely; the swimming pool area offers a pleasant, relaxing atmosphere; the  restaurants are good; the restaurant and reception staff are warmly attentive and responsive; and our room on the 8th floor was comfortably spacious an, though facing the main road, was well insulated from the sound.   All in all, we had a good stay.  There is, however, a systematic lack of attention to details that prevents me from scoring the hotel higher.  

The most aggravating of the lot was the passive concierge.  We wanted to make a restaurant reservation at the other Taj (Falaknuma).  Most hotel groups have internal processes for assisting guests from one hotel make reservations at sister hotels and normally, the concierge is the person to speak to.  Most concierge that we have encountered - in India and elsewhere - are right on top of such things...making every effort to sort things out.  Not here.  We started the process the day before in the morning -- and in spite of repeated promises that we would be informed in 1 hour, in 2 hours, soon, hours passed, the entire day passed and the night passed.  There seemed to be no sense of urgency.   By that time our reservation was confirmed -- 24 hours later, in the morning on the day of, we had given up and made a reservation at our second choice lest we lose out on both.   This type of lackadaisical attitude is not something some would expect from a Taj Hotel. 

In the room, there are electrical sockets on one side of the bed but not the other.  In this day and age when nearly everyone carries a smart phone and these serve, among other things, as a clock/alarm, most people want to charge their phones overnight on the nightstand next to the bed.  Only one of us was able to do that.

The bathroom lacked sufficiently bright lights around the mirror, especially lights directed at the individual.  With our faces in shadows, it was difficult to put on make up or shave.  Lights should be placed to illuminate the individual, not the sink top or alternatively, please install magnifying make-up mirrors with a light.   The water spray is generally located on the right side of the toilet -- for obvious reasons.  Here, it was on the left.  It just seemed like someone had bothered to think through these little details that are nonetheless important.  And finally, the bathtub was all scratched up -- so badly that at first glance, it looked filthy.  Regardless, it was definitely not enticing."
Amazing service,5,2024-02,04-02-2024,"Everyone was very approachable and was too nice 
Mr. Karim (Sir) and Ms.Deepa (Mam)   they both are very nice and their service was top-notch
Just amazing service done by Everyone keep it up 
Lots of love and blessings for everyone by my side

Big Thank You from my side 
Jhinuk Biswas 
Vistara"
The ambience and the service was really nice. Special thanks to Mr.Karim at the buffet who took extra care of providing,5,2024-02,03-02-2024,The ambience and the service was really nice. Special thanks to Mr.Karim at the buffet who took extra care of providing good customer service. The overall experience was really good and would love to visit again. Thank you for your services
Excellent service,5,2024-02,03-02-2024,"Amazing work done by Karim. Proactively doing all the services by heart. Amazing set of crew Taj Krishna . Having an amazing experience and enjoying every moment.
Love yo visit again very soon and would love explore the hotel again .
Regards,
Kritika"
Taj experience,5,2024-02,03-02-2024,"Had a great experience in Taj hotel, the staff of Taj they are amazing like always. This is not my 1st time in Taj, I have been to Taj many times. When ever I come here hospitality will on top. Thanks to all the Taj staff specially Karim and Domnic."
Appreciation towards the buffet service employees and housekeeping staffs.,5,2024-02,03-02-2024,"Had a wonderful experience. Mr.Kareem and Mr.Imtiyaz were very polite and delivered great customer service.They were friendly and good service .
Housekeeping team had done a splendid job . Everything I asked for was recieved on time without any delay."
Best hotel experience,5,2024-02,03-02-2024,"Karim and imtiaz were really sweet and i enjoyed their hospitality a lot. They helped us with whatever we needed and very proactive . Thanks for the great time again! Will definitely recommend it to near and dear ones. Also the northeastern girl, always has a smile on her face, makes us feel very warm"
Taj Krishna Hotel review.,5,2023-06,03-02-2024,this hotel location is very beautiful. And Hotel structure is very good. Hotel room is very fully AC  and furniture is condition very good. This is very safe for family stay of weekend. And hotel staff also very  smart.Hotel staff understanding with coming guest is very good. Staff provide service is very good.
"Amazing people, Excellent service",5,2024-01,02-02-2024,The staff here are amazing with their services especially Aviyash ! Thank you so much for wonderful service with a smile at an odd hour. Keep up the good work ! We ordered at mid  night but the staffs were very kind and  hard working . Very happy with the services.
Top notch facilities and wonderful hospitality.,4,2024-02,02-02-2024,"Amazing hospitality and very friendly and trained staff. All the facilities of the hotel which we used were topnotch . The pool was the best. The gym could have been more spacious. The room was neat and very well maintained. The hotel staff Sourav, Ajay, Swaty, Tania were really amazing and took good care of us. Thanks to wonderful team here at Krishna for the best ever hospitality and see you all very soon."
Memorable Stay for both Family and Friends.,5,2024-01,01-02-2024,"Excellent and memorable experience right from Check in to Check out.   Also had excellent service both at the restaurant and the Bar.  Special mention of the restaurant as they went out of the way on 28 January to serve us hot breakfast at 0645 before the restaurant officially opens, so that we could check out and leave by 07:00am.   Would surely consider staying in this property the next time we are back in Hyderabad"
Best service,5,2023-12,01-02-2024,"So the last time when we stayed in Taj krishna it was an amazing experience, starting from reception then room , housekeeping everyone was so excellent and professional. everything was done on time ,when we reached to the hotel our rooms were ready then after sometime Mr. Ajay also came to our room to check whether we are comfortable or not ,and trust me this was first time ever when someone has come to check whether we are comfortable.i would like to mention some name who impressed us with there exceptional services Saurav,tania ,yamini, Ajay and Swathi . truly one of the best employees and services."
Feedback for stay,5,2024-02,01-02-2024,"It’s always a memorable experience for me staying in taj ,lovely people with so much of energy and always keep a smile that make my day . 
Service is commendable , you ask for anything  it’s always there .  
Special thanks to ! These people 
Fahad,Pathak,Karim"
Wonderful relaxing hotel in the middle of Hyderabad,4,2024-01,31-01-2024,"Wonderful hotel with lovely garden area and pool. An oasis of calm in the middle of Hyderabad. Staff were friendly and helpful, especially Yasimi. She is a problem solver and always pleasant. Great food and excellent choice at the buffet. We were honoured to be invited to be part of the flag raising ceremony for Republish Day. Thank you.
 
My only niggle is the pigeons hanging around the outdoor restaurant. They are always ready to dive onto a table and when no one is seated they walk all round the tables/plates and the staff store station. Twice they dropped poo near us. They management need to be move active in getting rid of them or get some dummy hawks in place."
Taj krishna Reveiw,5,2023-12,30-01-2024,Excellent service and great place to be!The rooms were spacious and the service was top notch.The pool was very well maintained.Food was excellent.Even though the property is slightly old its well maintained and gives amazing access to any part of the city.
Great hospitality,5,2024-01,30-01-2024,"Had a fabulous time at Taj Krishna , visited on work trip and experienced excellent hospitality and comfortable stay. Dominic at the Encounter restaurant does a commendable job, always smiling and very welcoming. 
Thanks for a lovely stay"
Excellent,5,2024-01,30-01-2024,I would like to appreciate Deepa. She is very hard working.  Always keep smiling. She is calm person. She served me very well. Deepa is approachable. I would like to thank Deepa for serving me. Best hospitality given by her. Thank you once again.
Hotel,5,2023-12,30-01-2024,It was my parents anniversary and thought of planning lunch at Taj Krishna for their 25th anniversary which would be memorable for them. We had our lunch there . The food was really delicious and would like to visit again. The receptionist Yamini helped me with escort and suggested best dishes to try out. Thank you Yamini.
Excellent hotel,5,2024-01,30-01-2024,Its a fantastic day in taj Krishna where people and their services are very good its my business trip i had stayed in 628 room view was excellent and from reception Ms.yamini had given me nice room and explained everything about hotel i highly recommend this hotel
Thank you,5,2024-01,30-01-2024,Its a wonderful day in taj Krishna where I felt very special in their services ❣️ thankyou so much for everything and everyone did their best for us I want to thank yamini specially where she make my kid happy with chocolates and Ajay from house keeping too he is very genuine with his work helped us lot
Wonderful hospitality.,5,2024-01,30-01-2024,"Amazing Hotel in a convenient location. The services and facilities offered by krishna was top notch. What stood out the most was the courteous and friendly staff. Shout out to all of them at the Reception, Bell desk, Housekeeping and Restaurant for making our time at Krishna Memorable. Mr Sourav, Ms Swati, Ms Tania, Mr Ajay, Mr Domic , Mr Tomar were few among them. 
Would definitely recommend the Taj Krishna, thank again to the wonderful staff and management for a wonderful stay!"
Great experience with Mr. Karim Sir,5,2024-01,29-01-2024,"It was a very great experience with staff Mr. Karim Sir 
He is very approachable 
His service is excellent 
Food is very good 
Whatever we wants they have provided us 
Customer Service is very good here
It’s a very nice hotel
Rooms are very good

I am from Vistara Ms. Riddhi Shailesh Kahar

Thank you"
120,5,2024-01,29-01-2024,"Mr. Karim and Ms. Lalmi are exceptional with their services and very kind, sweet with their words and with everyone! They're very approachable, made our stay very comfortable . Would love to visit again and meet them again here. Taj is definitely reknow for its exceptional customer service"
Very nice staff and services.Always smiling and greeting everyone.staff makes sure that everyone is at their comfort.,5,2024-01,29-01-2024,Zarina Nandu sir Ajay sir Saroj I stayed at Taj Krishna on 29/01/2024 they are very good at their service whatsoever I needed they were on their toes.they are always smiling and I am very great full to stay at taj Krishna as they have amazing staff.I would like to give special thanks to Zarina as I was not well and she was there arranging all things in my room for me.
The True Taj Experience,5,2024-01,28-01-2024,living upto the true Taj experience… great rooms and mouth watering food… hospitality at its best..  from the time you enter to the room it is a great feeling … good for a leisure as well as business travel… was given a free upgrade in the room with a garden view …
"Wonderful Hospitality , Wonderful staff.",5,2024-01,28-01-2024,"We had our best time in Taj Krishna as always. The hotel is known for its excellent hospitality and is located in a prime location, with shopping malls, movies theatres and other attractions near by. We were warmly welcomed  by the friendly staffs at the reception . The rooms were well clean and maintained. The staff we came across were very friendly and warm. Our special mention to Sourav ,Tania and Pranit at the reception , Neel and Ajay of Housekeeping and Mr Jitesh from room dining for going just that little step extra for making for stay the most comfortable one. Would definetely recommend this hotel to everybody! 

Looking forward for many more wonderful experiences in the future."
Great food and staff,5,2024-01,27-01-2024,"Amazing food n service by team 

Fazal was great , had great time and food outstanding. 

Chef Jahangir
Gani service
Chef Somya

Very hospital staff and always completely satisfied with food. 
Amazing ambience 
Will visit again for food and hospitality"
Amazing experience,5,2024-01,24-01-2024,"It was a great experience and kudos to the housekeeping team (Suraj,Nandu ,Ajay) for taking care of us during our stay and mainly Suraj Sir is really sweet and hardworking person.Such staffs are an asset to the company.I really cherish everything I experienced here .We checked in very late but still all the services were upto the mark.Thank you so much all the team of Taj Krishna for giving us such comfortable and memorable stay ."
Exceeded our expectations.,5,2024-01,24-01-2024,"Amazing service from the staff. Best I have experienced. So kind and welcoming. Very bright and smart. Very accommodating and exceeding our requests and expectations. 
Delicious food and bufet. Fresh and so many options. 
Absolutely loved our stay at the Taj Krishna."
Mesmerising Stay,5,2024-01,23-01-2024,"It’s always and always a pleasure visiting Taj Krishna. The staff is phenomenal and Professional, Always takes good care of their customers starting from Airport pickup till the time of checkout.
I want to appreciate Mr. Pathak who was there for the service and took amazing care of us during buffet.
Keep up the amazing work.
Thank You."
Amazing ! Amazing ! Amazing!,4,2024-01,23-01-2024,"It is a lovely experience. Taj Hyderabad was the greatest since it was my first time visiting the Taj itself. It's a big room. From the cuisine to the bed, it's quite cosy and the food was really delicious and had lots of variation. And Thank you Ajay for the sweet surprise!"
Awesome Experience.,4,2024-01,23-01-2024,"The hotel is really nice and luxurious, they provide every little things in the room that's needed.  The services are excellent and workers are very respectful and humble. 
Overall great experience from Taj Krishna Hyderabad.  Shout out to the wonderful team here. Mr Ajay was very kind and took good care of us during our stay. Mr Jitesh from the room dining was amazing. Kudos to Housekeeping team Swati, Nandu and Acharya. Love to visit the hotel again."
Excellent,4,2024-01,22-01-2024,Mr pathak from dining area is so sweet and the whole team of taj Krishna are very sweet and helpful its was a great stay here every time i visit taj Krishna the staff makes us feel very comfortable and the chocolate waffles and always so tasty always reminds me of the waffles i had in london thank you for that nostalgic moment
Firdaus is a great Choice for Indian cuisine!! Excellent Staff!! Chef Jahangir is amazing!!,5,2024-01,19-01-2024,"We had family dinner at Firdaus at Taj Krishna. It was an excellent choice. The restaurant has everything to freshen up your mood for an Indian Family Dinning. Special thanks to these 3 people.
Chef Jahangir
Chef Sandeep
Mr.GL Reddy service
Great food. Great Taste. Great and humble Staff!! 
Thank you very much!!"
Amazing staff and excellent services,5,2024-01,18-01-2024,"Enjoyed my 02 nights at Taj Krishna, The Stay was Amazing and we enjoyed it thoroughly from the welcome at the lobby, the rooms and the food at restaurants . The best part about our stay was the Courtois staff we came across specially the housekeeping team. Mr Ajay and his team was very friendly. Thanks to Mr Sachin, Ms Devi and Mr Raju from housekeeping. We loved our stay and waiting for many more in the future ."
Exceptional hospitality,5,2023-12,18-01-2024,"Our stay at Krishna was truly one of the best experiences we've had recently. The hotel's wonderful ambience and the friendly staff contributed to an amazing overall stay. From the delectable food to the comfortable rooms and prompt services, every aspect was not only promising but exceeded our expectations. The entire team, with a special shoutout to the exceptional housekeeping staff, made our time here extraordinary. Mr. Ajay, the floor manager, along with his team members Sachin, Saroj, and Zarina, showcased exceptional kindness and took excellent care of us throughout our stay. We had a great time, and the memories created will be cherished forever."
A DAY IN TAJ KRISHNA,5,2024-01,18-01-2024,"I would like to present my gratitude to the THE TAJ KRISHNA  and specially the staff of THE TAJ KRISHNA.....honestly it was one of the best stay here.
I came here for my formal stay and honestly i became the fan of the services here.
The staff is very approachable and also on their toes always.
Everything was on time and i am very happy with my stay here and will recommend my friends and relatives for it as well.
Thank you so much once again."
Great staff.,5,2024-01,17-01-2024,"It was an amazing stay. The staff is very humble and approachable. The house keeping team was very helpful especially Mr. Sachin, Ms. Saroj, Ms. Zarina and Mr. Ajay. Special thanks to Mr. Ajay. Thank you all for a wonderful experience. Good customer service."
Wow experience by Ms.yamini,5,2024-01,17-01-2024,It's a wow stay with Taj Krishna and wonderful experience ❤️❤️ I had been here for a family trip for 2days only but yamini made our stay so beautiful we had checked in late night but she assited us very well and taken care of our kids very much thank you so much for this hospitality yamini really appreciated
The Best staff ever,5,2024-01,17-01-2024,The f&B staff Pathak was really nice he is so respectful and humble and he is doing justice to his work. I always visit Taj krishna for layover and he did stand out everytime.Keep up the good work Mr. Pathak keeping smiling and spread the good work.
Loved the Stay.,5,2024-01,16-01-2024,"I really liked the Ambiance here staff are  good and friendly, loved the traditional welcome with the mala and aarati.  The room was spacious and well maintained.  Mr Hair and Mr jitesh from the in room dining were amazing. We loved the the rooms and the housekeeping staff were polite. Mr Neel, Ajay and Acharya were cortious  and very helpful. Love to be here again in the future. Loved the stay as always."
